{
  "prid": "2232996",
  "ministry": "Ministry of Finance",
  "title": "Travelling Across the Industrial Corridors of India",
  "posted_on_raw": "26 FEB 2026 12:44PM",
  "source_url": "https://www.pib.gov.in/PressReleasePage.aspx?PRID=2232996",
  "pdfs": [
    {
      "label": "https://www.indiabudget.gov.in/doc/budget_speech.pdf",
      "url": "https://www.indiabudget.gov.in/doc/budget_speech.pdf"
    },
    {
      "label": "https://www.indiabudget.gov.in/economicsurvey/doc/eschapter/",
      "url": "https://www.indiabudget.gov.in/economicsurvey/doc/eschapter/echap08.pdf"
    },
    {
      "label": "https://www.cgihamburg.gov.in/pdf/Investment%20Opportunities",
      "url": "https://www.cgihamburg.gov.in/pdf/Investment%20Opportunities%20in%20Corridors.pdf"
    },
    {
      "label": "Click here to see pdf",
      "url": "https://static.pib.gov.in/WriteReadData/specificdocs/documents/2026/feb/doc2026226805701.pdf"
    }
  ],
  "text": "Press Release:Press Information Bureau\n\nPIB Headquarters\n\nTravelling Across the Industrial Corridors of India\n\nPosted On:\n26 FEB 2026 12:44PM by PIB Delhi\n\n\n\nKey Takeaways\n\nUnion Budget 2026-27 announced the\ndevelopment of an integrated East Coast Industrial Corridor with a well-connected node at Durgapur\n.\n\nA range of projects across\n11 Industrial Corridors\n are currently under implementation, with\n4 projects completed\nand\n4 nearing completion.\n\n₹3,000 crore\n under the\nBudget Estimates 2026-27\n allocated to\nNational Industrial Corridor Development and Implementation Trust (NICDIT)\n\nIntroduction\n\nIn recent times, Industrial corridors have surfaced as a central strategy for strengthening India’s industrial ecosystem, as they enable lower production costs, wider market access, and stronger integration with global production networks. To advance this model of industrial corridor-led development, the Government of India, together with State Governments, is establishing these corridors as planned economic zones supported by strong transport connectivity. This effort complements the\nNational Industrial Corridor Development Programme (NICDP)\n, through which the country is creating a network of modern industrial corridors equipped with future-ready manufacturing hubs, multimodal connectivity, and plug-and-play infrastructure.\n\nComplementing this vision, the Union Budget 2026-27 announced the\ndevelopment of an integrated East Coast Industrial Corridor with a well-connected node at Durgapur.\nThese initiatives are establishing new greenfield industrial areas, regions, and nodes structured to compete with premier manufacturing and investment destinations globally.\n\nWhat are Industrial Corridors and why do they matter?\n\nExploring the Concept of Industrial Corridors\n\nIndustrial corridors are linear development zones that connect major economic centres through an integrated network of roads, railways, ports, and airports. The defining features of these corridors are:\n\nPromotion of accelerated industrial growth\n by strengthening the link between industry and core infrastructure.\n\nCreation of globally comparable infrastructure\n along a defined pathway, offering a competitive and business-friendly environment.\n\nFacilitation of economic agglomeration and industrial clustering\n, helping regions maximise their growth potential.\n\nOptimal utilisation of regional strengths\n through focused investments and planned industrial development.\n\nDevelopment along major transport arteries\n, particularly rail trunk routes, ensuring strong connectivity for efficient movement of freight and the public.\n\n\n\nWhat Makes Industrial Corridors Essential\n\nIndustrial corridors play a fundamental role in metamorphosing regional economies by creating environments where industries can operate efficiently, sustainably, and competitively. Their importance is displayed in the following ways:\n\nIntegrated infrastructure strengthens industrial efficiency:\n Multimodal transport networks, reliable utilities, and ICT-enabled services create a unified ecosystem that supports efficient industrial operations and the movement of goods.\n\nPlug-and-play ecosystems accelerate business readiness:\n Ready-to-use facilities, assured utilities, and streamlined approvals reduce setup time, helping industries begin operations quickly and competitively.\n\nSustainability initiatives ensure responsible growth:\n Renewable energy adoption, waste recycling systems, and green building norms help industries expand while limiting environmental impact.\n\nSkill development initiatives encourage regional employment:\n Training programmes and partnerships with educational institutions build a skilled workforce, generating jobs and strengthening local economies.\n\nSpecial Economic Zones attract investment and promote exports:\n SEZs offer tax incentives and regulatory advantages that draw foreign investment and enhance India’s position in global value chains.\n\nPublic-Private Partnerships improve development outcomes:\n Cooperative models between government and industry ensure better planning, efficient resource use, and effective management.\n\nWalk-to-work planning elevates quality of life and productivity:\nReduced commuting, lower pollution, pedestrian-friendly layouts, and green spaces support healthier lifestyles and more productive urban environments, making industrial cities attractive to investors and workers alike.\n\n\n\n\n\nStrategic Government Interventions for Industrial Corridor Development\n\nAs India accelerates the creation of modern, well-connected industrial corridors, a series of government-led initiatives are laying the foundation for sustainable, competitive, and future-ready industrial growth.\n\n\n\nNational Industrial Corridor Development Programme (NICDP):\n\nThe Government of India is developing multiple Industrial Corridor Projects under the National Industrial Corridor Programme (NICDP), guided by the\nPM GatiShakti\n framework to ensure coordinated, multimodal connectivity for major economic zones.\n\nUnder this programme,\nvarious projects\n across\n11 corridors\n are being implemented. These projects are being developed through a sustainability-focused framework that supports the transition towards\nLow-Carbon Cities (LCCs)\n. Key elements of this approach include:\n\nCreation of extensive green spaces\n\nProvision of public transit systems\n\nAdoption of transit-oriented development (TOD)\n\nIntegration of renewable energy sources\n\nReduced dependence on conventional power\n\nConservation and recycling of water resources\n\nSystematic recovery and recycling of solid waste materials\n\n\n\nS. No.\n\nName of the Corridor\n\nProjects\n\n1.\n\nDelhi-Mumbai Industrial Corridor (DMIC)\n\nDholera Special Investment Region, Gujarat\n\nShendra Bidkin Industrial Area, Maharashtra\n\nIntegrated Industrial Township - Greater Noida, Uttar Pradesh\n\nIntegrated Industrial Township - Vikram Udyogpuri, Madhya Pradesh\n\nMulti Modal Logistics Hub & Multi Modal Transport Hub (MMLH & MMTH), Uttar Pradesh\n\nIntegrated Multi-Modal Logistics Hub, Nangal Chaudhary, Haryana\n\nDighi Port Industrial Area, Maharashtra\n\nMulti-Modal Logistics Park, Sanand, Gujarat\n\nJodhpur Pali Marwar Industrial Area, Rajasthan\n\nKhushkhera Bhiwadi Neemrana Industrial Area, Rajasthan\n\n2.\n\nChennai-Bengaluru Industrial Corridor (CBIC)\n\nKrishnapatnam Industrial Area, Andhra Pradesh\n\nTumakuru Industrial Area, Karnataka\n\nPonneri Industrial Area, Tamil Nadu\n\n3.\n\nAmritsar-Kolkata Industrial Corridor (AKIC)\n\nRaghunathpur Industrial Park, West Bengal\n\nHisar Integrated Manufacturing Cluster (IMC), Haryana\n\nPrag Khurpia Integrated Manufacturing Cluster (IMC), Uttarakhand\n\nRajpura Patiala IMC, Punjab\n\nNode near Kanpur for IMC, Uttar Pradesh\n\nBokaro Node, Jharkhand\n\nIMC at Gaya, Bihar\n\n4.\n\nVizag-Chennai Industrial Corridor (VCIC)\n\nKoparthy Industrial Area, Andhra Pradesh\n\nVisakhapatnam Industrial Area, Andhra Pradesh\n\nChittoor Industrial Area, Andhra Pradesh\n\n5.\n\nBengaluru-Mumbai Industrial Corridor (BMIC)\n\nDharwad Node, Karnataka\n\nSatara Node, Maharashtra\n\n6.\n\nExtension of CBIC to Kochi via Coimbatore (ECKC)\n\nPalakkad Industrial Area, Kerala\n\nDharmapuri-Salem Industrial Area, Tamil Nadu\n\n7.\n\nHyderabad-Nagpur Industrial Corridor (HNIC)\n\nZaheerabad Phase 1, Telangana\n\n8.\n\nHyderabad-Warangal Industrial Corridor (HWIC)\n\nHyderabad Phase 1, Telangana\n\n9.\n\nHyderabad-Bengaluru Industrial Corridor (HBIC)\n\nOrvakal Industrial Area, Andhra Pradesh\n\n10.\n\nOdisha Economic Corridor (OEC)\n\nGopalpur- Bhubaneswar- Kalinganagar Node and Paradip- Kendrapada- Dhamra- Subernarekha Node, Odisha\n\n11.\n\nDelhi-Nagpur Industrial Corridor (DNIC)\n\n--\n\n\n\nCurrent Status of some projects across Industrial Corridors:\n\n\n\nName of the Corridor\n\nCompleted Projects\n\nDescription\n\nInvestments\n\nDelhi-Mumbai Industrial Corridor (DMIC)\n\nDholera Special Investment Region (DSIR)\n\nIndia’s first semiconductor city\n and the largest node under the DMIC,\nspanning 920 sq. km\n.\n\nManaged by\nDholera Industrial City Development Limited (DICDL)\n, a Special Purpose Vehicle (SPV) of the Central Government and the Government of Gujarat.\n\nStrong connectivity through NH-8\n and the\nDedicated Freight Corridors\n\n(DFCs),\n enabling efficient logistics and transport.\n\nOffers\nlarge and scalable land parcels\n, making it suitable for major industrial and technological investments.\n\n22.54 sq. km Activation Area\n is\nalmost complete\n, with all\ntrunk infrastructure\n already established.\n\nAs per the\nEconomic Survey 2025-26\n, the Phase-I cities, such as DSIR, SBIA, IIT-GN and IIT-VUL, have collectively allotted\n350 industrial plots\n, attracting\n₹2.02 lakh crore in investments\n across sectors such as electronics, renewables, pharmaceuticals, and electric vehicles (EVs).\n\nShendra-Bidkin Industrial Area (SBIA)\n\nA\nGreenfield smart industrial city\n developed with\nworld-class infrastructure\n and\nplug-and-play industrial facilities\n.\n\nLocated in\nChhatrapati Sambhajinagar\n, it is strategically positioned near\nAurangabad Airport\n and is well-connected to the\nGolden Quadrilateral.\n\nSBIA targets high-growth sectors such as\nEVs, automotive, aerospace, electronics\n\nSBIA has the potential to attract\n₹67,815 crore\n in investments and generate\nover 55,000 jobs.\n\nIntegrated Industrial Township-Greater Noida (IIT-GN)\n\nSpans across\n747 acres\n and is a\nflagship project\n under the\nDMIC\n.\n\nLocated\nsoutheast of Greater Noida\n, directly abutting both the\nEastern Peripheral Expressway\n and the\nDelhi-Howrah Railway Line\n.\n\nConnectivity is strengthened through:\n\nDelhi-Howrah Railway Line\n\nEastern Peripheral Expressway\n\nProximity to the\nBoraki transit hub\n\nProximity to the\nDadri logistics hub\n\nTownship also enjoys strategic access through a network of\nexpressways\n and\nnational highways\n, along with proximity to key airports, including:\n\nIndira Gandhi International Airport (IGI)\n\nNoida International Airport (Jewar Airport)\n\nHindon Airport\n\nIntegrated Industrial Township Vikram Udyogpuri (IIT-VUL)\n\nSpans across\n1,100 acres\n in\nUjjain\n and is a major node of the\nDMIC\n.\n\nDrives the\nPithampur-Dhar-Mhow Investment Region.\n\nStrategically located near\nState Highway 18 (SH-18)\n and the\nUjjain-Dewas railway line.\n\nEquipped with\nstrong trunk infrastructure\n, including:\n\nRoads and internal circulation network\n\nReliable power supply\n\nWater distribution systems\n\nSewage Treatment Plants (STPs)\n\n\n\nName of the Corridor\n\nProjects Nearing Completion\n\nChennai Bengaluru Industrial Corridor (CBIC)\n\nTumakuru Industrial Area, Karnataka\n\nKrishnapatnam Industrial Area, Andhra Pradesh\n\nDelhi-Mumbai Industrial Corridor (DMIC)\n\nIntegrated Multi-Modal Logistics Hub (IMLH) Nangal Chaudhary, Haryana\n\nMulti-Modal Logistics Hub & Multi-Modal Transport Hub, Dadri, Greater Noida, U.P.\n\n\n\nIntroduction of 12 additional Projects:\n\nAs per the Budget 2024-25 announcement,\n12 projects\n under the National Industrial Corridor Development Programme were approved by the Government of India in August 2024 with a\ntotal project cost of ₹28,602 crore\n. These industrial smart cities are envisioned to develop globally benchmarked manufacturing and investment hubs, featuring plug-and-play facilities, smart city planning, and a walk-to-work ecosystem. They aim to create best-in-class, future-ready infrastructure designed ahead of demand.\n\nS. No.\n\nName of the Corridor\n\nName of the Project\n\nProject Area\n\nProject Cost\n\nInvestment Potential\n\nEmployment Potential\n\n1.\n\nAmritsar Kolkata Industrial Corridor (AKIC)\n\nIMC Khurpia, Uttarakhand\n\n1,002 acres\n\n₹ 1,265 crores\n\n₹ 6,180 crores\n\n75,057 jobs\n\n2.\n\nIMC Rajpura Patiala, Punjab\n\n1,099 acres\n\n₹ 1,367 crores\n\n₹ 7,500 crores\n\n64,204 jobs\n\n3.\n\nIMC Hisar, Haryana\n\n2,988 acres\n\n₹ 4,680 crores\n\n₹ 32,417 crores\n\n1,25,000 jobs\n\n4.\n\nIMC Agra, Uttar Pradesh\n\n1,058 acres\n\n₹ 1,812 crores\n\n₹ 3,447 crores\n\n69,516 jobs\n\n5.\n\nIMC Prayagraj, Uttar Pradesh\n\n352 acres\n\n₹ 658 crores\n\n₹ 1,600 crores\n\n17,700 jobs\n\n6.\n\nIMC Gaya, Bihar\n\n1,670 acres\n\n₹ 1,339 crores\n\n₹ 16,524 crores\n\n1,09,185 jobs\n\n7.\n\nDelhi-Mumbai Industrial Corridor (DMIC)\n\nIMC Dighi Port Industrial Area, Maharashtra\n\n6,056 acres\n\n₹ 5,469 crores\n\n₹ 38,000 crores\n\n1,14,183 jobs\n\n8.\n\nJodhpur Pali Marwar, Rajasthan\n\n1,578 acres\n\n₹ 922 crores\n\n₹ 7,500 crores\n\n40,000 jobs\n\n9.\n\nVizag-Chennai Industrial Corridor (VCIC)\n\nKopparthy, Andhra Pradesh\n\n2,596 acres\n\n₹ 2,137 crores\n\n₹ 8,860 crores\n\n54,500 jobs\n\n10.\n\nHyderabad-Bengaluru Industrial Corridor (HBIC)\n\nOrvakal, Andhra Pradesh\n\n2,621 acres\n\n₹ 2,786 crores\n\n₹ 12,000 crores\n\n45,071 jobs\n\n11.\n\nHyderabad-Nagpur Industrial Corridor (HNIC)\n\nZaheerabad, Telangana\n\n3,245 acres\n\n₹ 2,361 crores\n\n₹ 10,000 crores\n\n1,74,000 jobs\n\n12.\n\nKochi-Bengaluru Industrial Corridor\n\nPalakkad, Kerala\n\n1,710 acres\n\n₹ 3,806 crores\n\n₹ 8,729 crores\n\n51,000 jobs\n\nTotal\n\n25,975 acres\n\n₹ 28,602 crores\n\n₹ 152,757 crores\n\n939,416 jobs\n\n\n\nNational Industrial Corridor Development Corporation Limited (NICDC):\n\nThe\nNational Industrial Corridor Development Corporation Limited (NICDC)\n, previously known as\nDelhi Mumbai Industrial Corridor Development Corporation Limited (DMICDC)\n, was incorporated in\nJanuary 2008\n for the\ndevelopment, coordination, and implementation\n of the\nNational Industrial Corridor Development Programme (NICDP)\n by the\nGovernment of India\n. The NICDC:\n\naims to promote economic growth by developing\nsmart cities\n,\nindustrial clusters\n, and\nmulti-modal logistics hubs\n that integrate manufacturing, transport, and technology.\n\nis committed to creating\nbusiness-friendly and sustainable ecosystems\n with\nplug-and-play infrastructure\n,\nseamless connectivity\n, and\nmodern urban living standards\n.\n\nfocuses on strengthening\nthe manufacturing sector\n and\nsignificantly heightens India’s exports\n.\n\nNational Industrial Corridor Development and Implementation Trust (NICDIT):\n\nOn\n7 December 2016\n, the\nGovernment of India\n approved the expansion of the scope of the\nDMIC Project Implementation Trust Fund (PITF)\n and re-designated it as the\nNational Industrial Corridor Development and Implementation Trust (NICDIT)\n. The trust has been allocated\n₹3,000 crore\n under the\nBudget Estimates 2026-27\n.\n\nConclusion\n\nThe\nUnion Budget 2026-27\n gives strong momentum to India’s industrial expansion by announcing the creation of an\nIntegrated East Coast Industrial Corridor\n anchored by a major node at\nDurgapur\n. This initiative aligns with the broader vision of the\nNational Industrial Corridor Development Programme (NICDP)\n, which is steadily shaping a nationwide network of advanced production centres supported by transport linkages and ready-to-operate industrial facilities. With development progressing across\n11 Industrial Corridors,\n where\n4 locations are already operational,\n and\n4 are approaching completion\n, the government is steadily enhancing domestic manufacturing capacity, attracting substantial private investment, and generating large-scale employment. The introduction of\n12 additional projects\n highlights India’s intent to cultivate globally competitive manufacturing destinations rooted in sustainable design, technology-enabled administration, and compact urban planning that encourages a walk-to-work lifestyle. The\nNational Industrial Corridor Development Corporation Limited (NICDC)\n continues to play a central role by planning and guiding modern industrial townships, logistics hubs, and integrated production clusters. Complementing this effort, the\nNational Industrial Corridor Development and Implementation Trust (NICDIT)\n, supports the large-scale infrastructure creation, climate-conscious urban systems, and coordinated corridor-level development. These commitments place India on a firmer path to strengthening its industrial foundation, broadening its export potential, enhancing connectivity across regions, and shaping a forward-looking industrial ecosystem aligned with the country’s long-term economic goals.\n\nReferences\n\nMinistry of Finance\n\nhttps://www.indiabudget.gov.in/doc/budget_speech.pdf\n\nhttps://www.indiabudget.gov.in/economicsurvey/doc/eschapter/echap08.pdf\n\n\n\nMinistry of Commerce & Industry\n\nhttps://www.investindia.gov.in/blogs/concept-industrial-corridors-and-international-best-practices\n\nhttps://sansad.in/getFile/annex/269/AU693_5WT5P2.pdf?source=pqars\n\nhttps://sansad.in/getFile/loksabhaquestions/annex/185/AU1421_xw039v.pdf?source=pqals\n\nhttps://www.dpiit.gov.in/offerings/schemes-and-services/details/industrial-corridors-YjM2UDNtQWa\n\nhttps://www.nicdc.in/about/overview\n\nhttps://www.nicdc.in/projects/4-projects-developed/dholera-special-investment-region-gujarat\n\nhttps://www.nicdc.in/projects/4-projects-developed/shendra-bidkin-industrial-area-maharashtra\n\nhttps://www.nicdc.in/projects/4-projects-developed/integrated-industrial-township-greater-noida\n\nhttps://www.nicdc.in/projects/4-projects-developed/integrated-industrial-township-vikram-udyogpuri\n\nhttps://www.nicdc.in/projects/national-industrial-corridor-development-programme#\n\nhttps://www.nicdc.in/projects/4-projects-nearing-completion/tumakuru-industrial-area-karnataka\n\nhttps://www.nicdc.in/projects/4-projects-nearing-completion/krishnapatnam-industrial-area-andhra-pradesh\n\nhttps://www.nicdc.in/projects/4-projects-nearing-completion/integrated-multi-modal-logistics-hub-nangal-chaudhary\n\nhttps://www.nicdc.in/projects/4-projects-nearing-completion/multi-modal-logistics-and-transport-hub-dadri-greater-noida-up\n\nhttps://www.pib.gov.in/Pressreleaseshare.aspx?PRID=1557425&reg=3&lang=2\n\nhttps://www.nicdc.in/projects/12-new-projects/imc-rajpura-patiala-punjab\n\nhttps://www.nicdc.in/projects/12-new-projects/imc-hisar-haryana\n\nhttps://www.nicdc.in/projects/12-new-projects/imc-agra-uttar-pradesh\n\nhttps://www.pib.gov.in/PressReleasePage.aspx?PRID=2071860&reg=3&lang=2\n\nhttps://www.nicdc.in/projects/12-new-projects/imc-prayagraj-uttar-pradesh\n\nhttps://www.pib.gov.in/PressReleasePage.aspx?PRID=2072787&reg=3&lang=2\n\nhttps://www.nicdc.in/projects/12-new-projects/dighi-port-ind-area-maharashtra\n\nhttps://sansad.in/getFile/loksabhaquestions/annex/185/AU2614_KgDOB4.pdf?source=pqals\n\nhttps://www.nicdc.in/projects/12-new-projects/jodhpur-pali-marwar-rajasthan\n\nhttps://www.pib.gov.in/newsite/printrelease.aspx?relid=124032&reg=3&lang=2\n\nhttps://www.nicdc.in/projects/12-new-projects/kopparthy-andhra-pradesh\n\nhttps://www.nicdc.in/projects/12-new-projects/orvakal-andhra-pradesh\n\nhttps://www.nicdc.in/projects/12-new-projects/zaheerabad-telangana\n\nhttps://www.nicdc.in/projects/12-new-projects/palakkad-kerala\n\nhttps://sansad.in/getFile/loksabhaquestions/annex/184/AU2958_F5PrLx.pdf?source=pqals\n\nhttps://www.indiabudget.gov.in/doc/eb/vol1.pdf\n\nhttps://www.nicdc.in/resources/annual-reports/reports-of-nicdc\n\nhttps://www.commerce.gov.in/wp-content/uploads/2020/02/MOC_635963414360381849_Opportunities_India_CLMV_Region_EXIM_Bank.pdf\n\nhttps://www.dpiit.gov.in/ministry/about-us/details/Title=Industrial-Corridors-ITMwETMtQWa\n\n\n\nMinistry of Education\n\nhttps://iitpkd.ac.in/news/iit-palakkad-play-key-role-kochi-bengaluru-industrial-corridor\n\n\n\nConsulate General of India, Hamburg, Germany\n\nhttps://www.cgihamburg.gov.in/pdf/Investment%20Opportunities%20in%20Corridors.pdf\n\n\n\nEmbassy of India, Germany\n\nhttps://indianembassyberlin.gov.in/pages?id=NA,,&subid=MTk0&nextid=Mjc5\n\n\n\nUnited Nations Development Programme (UNDP)\n\nhttps://www.undp.org/malaysia/news/low-carbon-cities-malaysias-response-global-climate-emergency\n\nClick here to see pdf\n\n***\n\nPIB Research\n\n(Release ID: 2232996)\n\nVisitor Counter : 449\n\nRead this release in:\n\nUrdu\n\n,\n\nBengali\n\n,\n\nGujarati\n\n,\n\nTamil\n\nPIB Headquarters\n\nTravelling Across the Industrial Corridors of India\n\nPosted On:\n26 FEB 2026 12:44PM by PIB Delhi\n\n\n\nKey Takeaways\n\nUnion Budget 2026-27 announced the\ndevelopment of an integrated East Coast Industrial Corridor with a well-connected node at Durgapur\n.\n\nA range of projects across\n11 Industrial Corridors\n are currently under implementation, with\n4 projects completed\nand\n4 nearing completion.\n\n₹3,000 crore\n under the\nBudget Estimates 2026-27\n allocated to\nNational Industrial Corridor Development and Implementation Trust (NICDIT)\n\nIntroduction\n\nIn recent times, Industrial corridors have surfaced as a central strategy for strengthening India’s industrial ecosystem, as they enable lower production costs, wider market access, and stronger integration with global production networks. To advance this model of industrial corridor-led development, the Government of India, together with State Governments, is establishing these corridors as planned economic zones supported by strong transport connectivity. This effort complements the\nNational Industrial Corridor Development Programme (NICDP)\n, through which the country is creating a network of modern industrial corridors equipped with future-ready manufacturing hubs, multimodal connectivity, and plug-and-play infrastructure.\n\nComplementing this vision, the Union Budget 2026-27 announced the\ndevelopment of an integrated East Coast Industrial Corridor with a well-connected node at Durgapur.\nThese initiatives are establishing new greenfield industrial areas, regions, and nodes structured to compete with premier manufacturing and investment destinations globally.\n\nWhat are Industrial Corridors and why do they matter?\n\nExploring the Concept of Industrial Corridors\n\nIndustrial corridors are linear development zones that connect major economic centres through an integrated network of roads, railways, ports, and airports. The defining features of these corridors are:\n\nPromotion of accelerated industrial growth\n by strengthening the link between industry and core infrastructure.\n\nCreation of globally comparable infrastructure\n along a defined pathway, offering a competitive and business-friendly environment.\n\nFacilitation of economic agglomeration and industrial clustering\n, helping regions maximise their growth potential.\n\nOptimal utilisation of regional strengths\n through focused investments and planned industrial development.\n\nDevelopment along major transport arteries\n, particularly rail trunk routes, ensuring strong connectivity for efficient movement of freight and the public.\n\n\n\nWhat Makes Industrial Corridors Essential\n\nIndustrial corridors play a fundamental role in metamorphosing regional economies by creating environments where industries can operate efficiently, sustainably, and competitively. Their importance is displayed in the following ways:\n\nIntegrated infrastructure strengthens industrial efficiency:\n Multimodal transport networks, reliable utilities, and ICT-enabled services create a unified ecosystem that supports efficient industrial operations and the movement of goods.\n\nPlug-and-play ecosystems accelerate business readiness:\n Ready-to-use facilities, assured utilities, and streamlined approvals reduce setup time, helping industries begin operations quickly and competitively.\n\nSustainability initiatives ensure responsible growth:\n Renewable energy adoption, waste recycling systems, and green building norms help industries expand while limiting environmental impact.\n\nSkill development initiatives encourage regional employment:\n Training programmes and partnerships with educational institutions build a skilled workforce, generating jobs and strengthening local economies.\n\nSpecial Economic Zones attract investment and promote exports:\n SEZs offer tax incentives and regulatory advantages that draw foreign investment and enhance India’s position in global value chains.\n\nPublic-Private Partnerships improve development outcomes:\n Cooperative models between government and industry ensure better planning, efficient resource use, and effective management.\n\nWalk-to-work planning elevates quality of life and productivity:\nReduced commuting, lower pollution, pedestrian-friendly layouts, and green spaces support healthier lifestyles and more productive urban environments, making industrial cities attractive to investors and workers alike.\n\n\n\n\n\nStrategic Government Interventions for Industrial Corridor Development\n\nAs India accelerates the creation of modern, well-connected industrial corridors, a series of government-led initiatives are laying the foundation for sustainable, competitive, and future-ready industrial growth.\n\n\n\nNational Industrial Corridor Development Programme (NICDP):\n\nThe Government of India is developing multiple Industrial Corridor Projects under the National Industrial Corridor Programme (NICDP), guided by the\nPM GatiShakti\n framework to ensure coordinated, multimodal connectivity for major economic zones.\n\nUnder this programme,\nvarious projects\n across\n11 corridors\n are being implemented. These projects are being developed through a sustainability-focused framework that supports the transition towards\nLow-Carbon Cities (LCCs)\n. Key elements of this approach include:\n\nCreation of extensive green spaces\n\nProvision of public transit systems\n\nAdoption of transit-oriented development (TOD)\n\nIntegration of renewable energy sources\n\nReduced dependence on conventional power\n\nConservation and recycling of water resources\n\nSystematic recovery and recycling of solid waste materials\n\n\n\nS. No.\n\nName of the Corridor\n\nProjects\n\n1.\n\nDelhi-Mumbai Industrial Corridor (DMIC)\n\nDholera Special Investment Region, Gujarat\n\nShendra Bidkin Industrial Area, Maharashtra\n\nIntegrated Industrial Township - Greater Noida, Uttar Pradesh\n\nIntegrated Industrial Township - Vikram Udyogpuri, Madhya Pradesh\n\nMulti Modal Logistics Hub & Multi Modal Transport Hub (MMLH & MMTH), Uttar Pradesh\n\nIntegrated Multi-Modal Logistics Hub, Nangal Chaudhary, Haryana\n\nDighi Port Industrial Area, Maharashtra\n\nMulti-Modal Logistics Park, Sanand, Gujarat\n\nJodhpur Pali Marwar Industrial Area, Rajasthan\n\nKhushkhera Bhiwadi Neemrana Industrial Area, Rajasthan\n\n2.\n\nChennai-Bengaluru Industrial Corridor (CBIC)\n\nKrishnapatnam Industrial Area, Andhra Pradesh\n\nTumakuru Industrial Area, Karnataka\n\nPonneri Industrial Area, Tamil Nadu\n\n3.\n\nAmritsar-Kolkata Industrial Corridor (AKIC)\n\nRaghunathpur Industrial Park, West Bengal\n\nHisar Integrated Manufacturing Cluster (IMC), Haryana\n\nPrag Khurpia Integrated Manufacturing Cluster (IMC), Uttarakhand\n\nRajpura Patiala IMC, Punjab\n\nNode near Kanpur for IMC, Uttar Pradesh\n\nBokaro Node, Jharkhand\n\nIMC at Gaya, Bihar\n\n4.\n\nVizag-Chennai Industrial Corridor (VCIC)\n\nKoparthy Industrial Area, Andhra Pradesh\n\nVisakhapatnam Industrial Area, Andhra Pradesh\n\nChittoor Industrial Area, Andhra Pradesh\n\n5.\n\nBengaluru-Mumbai Industrial Corridor (BMIC)\n\nDharwad Node, Karnataka\n\nSatara Node, Maharashtra\n\n6.\n\nExtension of CBIC to Kochi via Coimbatore (ECKC)\n\nPalakkad Industrial Area, Kerala\n\nDharmapuri-Salem Industrial Area, Tamil Nadu\n\n7.\n\nHyderabad-Nagpur Industrial Corridor (HNIC)\n\nZaheerabad Phase 1, Telangana\n\n8.\n\nHyderabad-Warangal Industrial Corridor (HWIC)\n\nHyderabad Phase 1, Telangana\n\n9.\n\nHyderabad-Bengaluru Industrial Corridor (HBIC)\n\nOrvakal Industrial Area, Andhra Pradesh\n\n10.\n\nOdisha Economic Corridor (OEC)\n\nGopalpur- Bhubaneswar- Kalinganagar Node and Paradip- Kendrapada- Dhamra- Subernarekha Node, Odisha\n\n11.\n\nDelhi-Nagpur Industrial Corridor (DNIC)\n\n--\n\n\n\nCurrent Status of some projects across Industrial Corridors:\n\n\n\nName of the Corridor\n\nCompleted Projects\n\nDescription\n\nInvestments\n\nDelhi-Mumbai Industrial Corridor (DMIC)\n\nDholera Special Investment Region (DSIR)\n\nIndia’s first semiconductor city\n and the largest node under the DMIC,\nspanning 920 sq. km\n.\n\nManaged by\nDholera Industrial City Development Limited (DICDL)\n, a Special Purpose Vehicle (SPV) of the Central Government and the Government of Gujarat.\n\nStrong connectivity through NH-8\n and the\nDedicated Freight Corridors\n\n(DFCs),\n enabling efficient logistics and transport.\n\nOffers\nlarge and scalable land parcels\n, making it suitable for major industrial and technological investments.\n\n22.54 sq. km Activation Area\n is\nalmost complete\n, with all\ntrunk infrastructure\n already established.\n\nAs per the\nEconomic Survey 2025-26\n, the Phase-I cities, such as DSIR, SBIA, IIT-GN and IIT-VUL, have collectively allotted\n350 industrial plots\n, attracting\n₹2.02 lakh crore in investments\n across sectors such as electronics, renewables, pharmaceuticals, and electric vehicles (EVs).\n\nShendra-Bidkin Industrial Area (SBIA)\n\nA\nGreenfield smart industrial city\n developed with\nworld-class infrastructure\n and\nplug-and-play industrial facilities\n.\n\nLocated in\nChhatrapati Sambhajinagar\n, it is strategically positioned near\nAurangabad Airport\n and is well-connected to the\nGolden Quadrilateral.\n\nSBIA targets high-growth sectors such as\nEVs, automotive, aerospace, electronics\n\nSBIA has the potential to attract\n₹67,815 crore\n in investments and generate\nover 55,000 jobs.\n\nIntegrated Industrial Township-Greater Noida (IIT-GN)\n\nSpans across\n747 acres\n and is a\nflagship project\n under the\nDMIC\n.\n\nLocated\nsoutheast of Greater Noida\n, directly abutting both the\nEastern Peripheral Expressway\n and the\nDelhi-Howrah Railway Line\n.\n\nConnectivity is strengthened through:\n\nDelhi-Howrah Railway Line\n\nEastern Peripheral Expressway\n\nProximity to the\nBoraki transit hub\n\nProximity to the\nDadri logistics hub\n\nTownship also enjoys strategic access through a network of\nexpressways\n and\nnational highways\n, along with proximity to key airports, including:\n\nIndira Gandhi International Airport (IGI)\n\nNoida International Airport (Jewar Airport)\n\nHindon Airport\n\nIntegrated Industrial Township Vikram Udyogpuri (IIT-VUL)\n\nSpans across\n1,100 acres\n in\nUjjain\n and is a major node of the\nDMIC\n.\n\nDrives the\nPithampur-Dhar-Mhow Investment Region.\n\nStrategically located near\nState Highway 18 (SH-18)\n and the\nUjjain-Dewas railway line.\n\nEquipped with\nstrong trunk infrastructure\n, including:\n\nRoads and internal circulation network\n\nReliable power supply\n\nWater distribution systems\n\nSewage Treatment Plants (STPs)\n\n\n\nName of the Corridor\n\nProjects Nearing Completion\n\nChennai Bengaluru Industrial Corridor (CBIC)\n\nTumakuru Industrial Area, Karnataka\n\nKrishnapatnam Industrial Area, Andhra Pradesh\n\nDelhi-Mumbai Industrial Corridor (DMIC)\n\nIntegrated Multi-Modal Logistics Hub (IMLH) Nangal Chaudhary, Haryana\n\nMulti-Modal Logistics Hub & Multi-Modal Transport Hub, Dadri, Greater Noida, U.P.\n\n\n\nIntroduction of 12 additional Projects:\n\nAs per the Budget 2024-25 announcement,\n12 projects\n under the National Industrial Corridor Development Programme were approved by the Government of India in August 2024 with a\ntotal project cost of ₹28,602 crore\n. These industrial smart cities are envisioned to develop globally benchmarked manufacturing and investment hubs, featuring plug-and-play facilities, smart city planning, and a walk-to-work ecosystem. They aim to create best-in-class, future-ready infrastructure designed ahead of demand.\n\nS. No.\n\nName of the Corridor\n\nName of the Project\n\nProject Area\n\nProject Cost\n\nInvestment Potential\n\nEmployment Potential\n\n1.\n\nAmritsar Kolkata Industrial Corridor (AKIC)\n\nIMC Khurpia, Uttarakhand\n\n1,002 acres\n\n₹ 1,265 crores\n\n₹ 6,180 crores\n\n75,057 jobs\n\n2.\n\nIMC Rajpura Patiala, Punjab\n\n1,099 acres\n\n₹ 1,367 crores\n\n₹ 7,500 crores\n\n64,204 jobs\n\n3.\n\nIMC Hisar, Haryana\n\n2,988 acres\n\n₹ 4,680 crores\n\n₹ 32,417 crores\n\n1,25,000 jobs\n\n4.\n\nIMC Agra, Uttar Pradesh\n\n1,058 acres\n\n₹ 1,812 crores\n\n₹ 3,447 crores\n\n69,516 jobs\n\n5.\n\nIMC Prayagraj, Uttar Pradesh\n\n352 acres\n\n₹ 658 crores\n\n₹ 1,600 crores\n\n17,700 jobs\n\n6.\n\nIMC Gaya, Bihar\n\n1,670 acres\n\n₹ 1,339 crores\n\n₹ 16,524 crores\n\n1,09,185 jobs\n\n7.\n\nDelhi-Mumbai Industrial Corridor (DMIC)\n\nIMC Dighi Port Industrial Area, Maharashtra\n\n6,056 acres\n\n₹ 5,469 crores\n\n₹ 38,000 crores\n\n1,14,183 jobs\n\n8.\n\nJodhpur Pali Marwar, Rajasthan\n\n1,578 acres\n\n₹ 922 crores\n\n₹ 7,500 crores\n\n40,000 jobs\n\n9.\n\nVizag-Chennai Industrial Corridor (VCIC)\n\nKopparthy, Andhra Pradesh\n\n2,596 acres\n\n₹ 2,137 crores\n\n₹ 8,860 crores\n\n54,500 jobs\n\n10.\n\nHyderabad-Bengaluru Industrial Corridor (HBIC)\n\nOrvakal, Andhra Pradesh\n\n2,621 acres\n\n₹ 2,786 crores\n\n₹ 12,000 crores\n\n45,071 jobs\n\n11.\n\nHyderabad-Nagpur Industrial Corridor (HNIC)\n\nZaheerabad, Telangana\n\n3,245 acres\n\n₹ 2,361 crores\n\n₹ 10,000 crores\n\n1,74,000 jobs\n\n12.\n\nKochi-Bengaluru Industrial Corridor\n\nPalakkad, Kerala\n\n1,710 acres\n\n₹ 3,806 crores\n\n₹ 8,729 crores\n\n51,000 jobs\n\nTotal\n\n25,975 acres\n\n₹ 28,602 crores\n\n₹ 152,757 crores\n\n939,416 jobs\n\n\n\nNational Industrial Corridor Development Corporation Limited (NICDC):\n\nThe\nNational Industrial Corridor Development Corporation Limited (NICDC)\n, previously known as\nDelhi Mumbai Industrial Corridor Development Corporation Limited (DMICDC)\n, was incorporated in\nJanuary 2008\n for the\ndevelopment, coordination, and implementation\n of the\nNational Industrial Corridor Development Programme (NICDP)\n by the\nGovernment of India\n. The NICDC:\n\naims to promote economic growth by developing\nsmart cities\n,\nindustrial clusters\n, and\nmulti-modal logistics hubs\n that integrate manufacturing, transport, and technology.\n\nis committed to creating\nbusiness-friendly and sustainable ecosystems\n with\nplug-and-play infrastructure\n,\nseamless connectivity\n, and\nmodern urban living standards\n.\n\nfocuses on strengthening\nthe manufacturing sector\n and\nsignificantly heightens India’s exports\n.\n\nNational Industrial Corridor Development and Implementation Trust (NICDIT):\n\nOn\n7 December 2016\n, the\nGovernment of India\n approved the expansion of the scope of the\nDMIC Project Implementation Trust Fund (PITF)\n and re-designated it as the\nNational Industrial Corridor Development and Implementation Trust (NICDIT)\n. The trust has been allocated\n₹3,000 crore\n under the\nBudget Estimates 2026-27\n.\n\nConclusion\n\nThe\nUnion Budget 2026-27\n gives strong momentum to India’s industrial expansion by announcing the creation of an\nIntegrated East Coast Industrial Corridor\n anchored by a major node at\nDurgapur\n. This initiative aligns with the broader vision of the\nNational Industrial Corridor Development Programme (NICDP)\n, which is steadily shaping a nationwide network of advanced production centres supported by transport linkages and ready-to-operate industrial facilities. With development progressing across\n11 Industrial Corridors,\n where\n4 locations are already operational,\n and\n4 are approaching completion\n, the government is steadily enhancing domestic manufacturing capacity, attracting substantial private investment, and generating large-scale employment. The introduction of\n12 additional projects\n highlights India’s intent to cultivate globally competitive manufacturing destinations rooted in sustainable design, technology-enabled administration, and compact urban planning that encourages a walk-to-work lifestyle. The\nNational Industrial Corridor Development Corporation Limited (NICDC)\n continues to play a central role by planning and guiding modern industrial townships, logistics hubs, and integrated production clusters. Complementing this effort, the\nNational Industrial Corridor Development and Implementation Trust (NICDIT)\n, supports the large-scale infrastructure creation, climate-conscious urban systems, and coordinated corridor-level development. These commitments place India on a firmer path to strengthening its industrial foundation, broadening its export potential, enhancing connectivity across regions, and shaping a forward-looking industrial ecosystem aligned with the country’s long-term economic goals.\n\nReferences\n\nMinistry of Finance\n\nhttps://www.indiabudget.gov.in/doc/budget_speech.pdf\n\nhttps://www.indiabudget.gov.in/economicsurvey/doc/eschapter/echap08.pdf\n\n\n\nMinistry of Commerce & Industry\n\nhttps://www.investindia.gov.in/blogs/concept-industrial-corridors-and-international-best-practices\n\nhttps://sansad.in/getFile/annex/269/AU693_5WT5P2.pdf?source=pqars\n\nhttps://sansad.in/getFile/loksabhaquestions/annex/185/AU1421_xw039v.pdf?source=pqals\n\nhttps://www.dpiit.gov.in/offerings/schemes-and-services/details/industrial-corridors-YjM2UDNtQWa\n\nhttps://www.nicdc.in/about/overview\n\nhttps://www.nicdc.in/projects/4-projects-developed/dholera-special-investment-region-gujarat\n\nhttps://www.nicdc.in/projects/4-projects-developed/shendra-bidkin-industrial-area-maharashtra\n\nhttps://www.nicdc.in/projects/4-projects-developed/integrated-industrial-township-greater-noida\n\nhttps://www.nicdc.in/projects/4-projects-developed/integrated-industrial-township-vikram-udyogpuri\n\nhttps://www.nicdc.in/projects/national-industrial-corridor-development-programme#\n\nhttps://www.nicdc.in/projects/4-projects-nearing-completion/tumakuru-industrial-area-karnataka\n\nhttps://www.nicdc.in/projects/4-projects-nearing-completion/krishnapatnam-industrial-area-andhra-pradesh\n\nhttps://www.nicdc.in/projects/4-projects-nearing-completion/integrated-multi-modal-logistics-hub-nangal-chaudhary\n\nhttps://www.nicdc.in/projects/4-projects-nearing-completion/multi-modal-logistics-and-transport-hub-dadri-greater-noida-up\n\nhttps://www.pib.gov.in/Pressreleaseshare.aspx?PRID=1557425&reg=3&lang=2\n\nhttps://www.nicdc.in/projects/12-new-projects/imc-rajpura-patiala-punjab\n\nhttps://www.nicdc.in/projects/12-new-projects/imc-hisar-haryana\n\nhttps://www.nicdc.in/projects/12-new-projects/imc-agra-uttar-pradesh\n\nhttps://www.pib.gov.in/PressReleasePage.aspx?PRID=2071860&reg=3&lang=2\n\nhttps://www.nicdc.in/projects/12-new-projects/imc-prayagraj-uttar-pradesh\n\nhttps://www.pib.gov.in/PressReleasePage.aspx?PRID=2072787&reg=3&lang=2\n\nhttps://www.nicdc.in/projects/12-new-projects/dighi-port-ind-area-maharashtra\n\nhttps://sansad.in/getFile/loksabhaquestions/annex/185/AU2614_KgDOB4.pdf?source=pqals\n\nhttps://www.nicdc.in/projects/12-new-projects/jodhpur-pali-marwar-rajasthan\n\nhttps://www.pib.gov.in/newsite/printrelease.aspx?relid=124032&reg=3&lang=2\n\nhttps://www.nicdc.in/projects/12-new-projects/kopparthy-andhra-pradesh\n\nhttps://www.nicdc.in/projects/12-new-projects/orvakal-andhra-pradesh\n\nhttps://www.nicdc.in/projects/12-new-projects/zaheerabad-telangana\n\nhttps://www.nicdc.in/projects/12-new-projects/palakkad-kerala\n\nhttps://sansad.in/getFile/loksabhaquestions/annex/184/AU2958_F5PrLx.pdf?source=pqals\n\nhttps://www.indiabudget.gov.in/doc/eb/vol1.pdf\n\nhttps://www.nicdc.in/resources/annual-reports/reports-of-nicdc\n\nhttps://www.commerce.gov.in/wp-content/uploads/2020/02/MOC_635963414360381849_Opportunities_India_CLMV_Region_EXIM_Bank.pdf\n\nhttps://www.dpiit.gov.in/ministry/about-us/details/Title=Industrial-Corridors-ITMwETMtQWa\n\n\n\nMinistry of Education\n\nhttps://iitpkd.ac.in/news/iit-palakkad-play-key-role-kochi-bengaluru-industrial-corridor\n\n\n\nConsulate General of India, Hamburg, Germany\n\nhttps://www.cgihamburg.gov.in/pdf/Investment%20Opportunities%20in%20Corridors.pdf\n\n\n\nEmbassy of India, Germany\n\nhttps://indianembassyberlin.gov.in/pages?id=NA,,&subid=MTk0&nextid=Mjc5\n\n\n\nUnited Nations Development Programme (UNDP)\n\nhttps://www.undp.org/malaysia/news/low-carbon-cities-malaysias-response-global-climate-emergency\n\nClick here to see pdf\n\n***\n\nPIB Research\n\n(Release ID: 2232996)",
  "fetched_at_utc": "2026-02-26T14:26:13.524681+00:00"
}