{
  "prid": "2234116",
  "ministry": "Ministry of Finance",
  "title": "Central Board of Indirect Taxes and Customs (CBIC) introduces deferred Customs Duty payment facility for Eligible Manufacturer Importers as announced in Union Budget 2026-27",
  "posted_on_raw": "01 MAR 2026 10:35AM",
  "source_url": "https://www.pib.gov.in/PressReleasePage.aspx?PRID=2234116",
  "pdfs": [
    {
      "label": "CLICK HERE TO ACCESS CIRCULAR NO. 08/2026-CUSTOMS",
      "url": "https://static.pib.gov.in/WriteReadData/specificdocs/documents/2026/mar/doc202631807301.pdf"
    }
  ],
  "text": "Press Release:Press Information Bureau\n\nMinistry of Finance\n\nCentral Board of Indirect Taxes and Customs (CBIC) introduces deferred Customs Duty payment facility for Eligible Manufacturer Importers as announced in Union Budget 2026-27\n\nCBIC also notifies eligibility and guidelines for Eligible Manufacturer Importer Scheme\nEMI Scheme is a Trust-Based Customs Facilitation Scheme to improve cash flow, promote compliance and boost domestic manufacturing, and facilitate Ease of Doing Business\nEMI facility will be available from 1st April, 2026 and will remain in force till 31st March, 2028\nApplications under the EMI scheme can be submitted online from 1st March, 2026 on the AEO portal at www.aeoindia.gov.in under the tab “Eligible Manufacturer Importer”\n\nPosted On:\n01 MAR 2026 10:35AM by PIB Delhi\n\nIn pursuance of the Union Budget 2026–27 announcement by the Union Minister for Finance and Corporate Affairs, the Central Board of Indirect Taxes and Customs (CBIC) has introduced a new facilitation measure for trusted manufacturers by enabling the facility of deferred payment of Customs duty to a new category of importers called Eligible Manufacturer Importers (EMIs). CBIC has issued detailed eligibility conditions, application process and operational guidelines through Circular No. 08/2026-Customs dated 28\nth\n February, 2026, in this regard.\n\nUnder this initiative, Eligible Manufacturer Importers (EMI) will be able to clear imported goods without paying Customs duty at the time of clearance. Instead, the applicable duty can be paid on a monthly basis as prescribed under the Deferred Payment of Import Duty Rules, 2016, helping manufacturers better manage cash flows and working capital.\n\nThe facility will be available from 1\nst\n April, 2026 and will remain in force till 31\nst\n March, 2028. The deferred payment facility shall be available to EMI meeting prescribed criteria related to Customs and GST compliance, turnover, financial standing and past track record. Existing AEO-T1 entities, including MSMEs, that fulfil the eligibility conditions are also eligible to participate.\n\nThe EMI scheme is designed as a trust-based facilitation measure, encouraging compliant manufacturers to benefit from simplified procedures while nudging them towards higher levels of compliance. During the validity period of the scheme, approved Eligible Manufacturer Importers are expected to progressively obtain AEO-T2 or AEO-T3 status, enabling access to enhanced facilitation, faster clearances and priority treatment under the AEO Programme.\n\nApplications under the EMI scheme can be submitted online from 1\nst\n March, 2026 on the AEO portal at\nwww.aeoindia.gov.in\n under the tab “Eligible Manufacturer Importer”.\n\nThis reform is expected to significantly improve ease of doing business, strengthen the compliance culture, promote wider participation in the AEO programme and provide a boost to domestic manufacturing. It reflects CBIC’s continued commitment to creating a predictable, efficient and facilitative Customs environment to support India’s manufacturing-led and export-oriented growth.\n\nCLICK HERE TO ACCESS CIRCULAR NO. 08/2026-CUSTOMS\n\n****\n\nNB/KMN\n\n(Release ID: 2234116)\n\nVisitor Counter : 738\n\nRead this release in:\n\nMalayalam\n\n,\n\nUrdu\n\n,\n\nहिन्दी\n\n,\n\nGujarati\n\n,\n\nTamil\n\nMinistry of Finance\n\nCentral Board of Indirect Taxes and Customs (CBIC) introduces deferred Customs Duty payment facility for Eligible Manufacturer Importers as announced in Union Budget 2026-27\n\nCBIC also notifies eligibility and guidelines for Eligible Manufacturer Importer Scheme\nEMI Scheme is a Trust-Based Customs Facilitation Scheme to improve cash flow, promote compliance and boost domestic manufacturing, and facilitate Ease of Doing Business\nEMI facility will be available from 1st April, 2026 and will remain in force till 31st March, 2028\nApplications under the EMI scheme can be submitted online from 1st March, 2026 on the AEO portal at www.aeoindia.gov.in under the tab “Eligible Manufacturer Importer”\n\nPosted On:\n01 MAR 2026 10:35AM by PIB Delhi\n\nIn pursuance of the Union Budget 2026–27 announcement by the Union Minister for Finance and Corporate Affairs, the Central Board of Indirect Taxes and Customs (CBIC) has introduced a new facilitation measure for trusted manufacturers by enabling the facility of deferred payment of Customs duty to a new category of importers called Eligible Manufacturer Importers (EMIs). CBIC has issued detailed eligibility conditions, application process and operational guidelines through Circular No. 08/2026-Customs dated 28\nth\n February, 2026, in this regard.\n\nUnder this initiative, Eligible Manufacturer Importers (EMI) will be able to clear imported goods without paying Customs duty at the time of clearance. Instead, the applicable duty can be paid on a monthly basis as prescribed under the Deferred Payment of Import Duty Rules, 2016, helping manufacturers better manage cash flows and working capital.\n\nThe facility will be available from 1\nst\n April, 2026 and will remain in force till 31\nst\n March, 2028. The deferred payment facility shall be available to EMI meeting prescribed criteria related to Customs and GST compliance, turnover, financial standing and past track record. Existing AEO-T1 entities, including MSMEs, that fulfil the eligibility conditions are also eligible to participate.\n\nThe EMI scheme is designed as a trust-based facilitation measure, encouraging compliant manufacturers to benefit from simplified procedures while nudging them towards higher levels of compliance. During the validity period of the scheme, approved Eligible Manufacturer Importers are expected to progressively obtain AEO-T2 or AEO-T3 status, enabling access to enhanced facilitation, faster clearances and priority treatment under the AEO Programme.\n\nApplications under the EMI scheme can be submitted online from 1\nst\n March, 2026 on the AEO portal at\nwww.aeoindia.gov.in\n under the tab “Eligible Manufacturer Importer”.\n\nThis reform is expected to significantly improve ease of doing business, strengthen the compliance culture, promote wider participation in the AEO programme and provide a boost to domestic manufacturing. It reflects CBIC’s continued commitment to creating a predictable, efficient and facilitative Customs environment to support India’s manufacturing-led and export-oriented growth.\n\nCLICK HERE TO ACCESS CIRCULAR NO. 08/2026-CUSTOMS\n\n****\n\nNB/KMN\n\n(Release ID: 2234116)",
  "fetched_at_utc": "2026-03-01T16:37:33.857511+00:00"
}